,reviews
817,"I usually stay at the Four Seasons when in Chicago.  Last week I tried another highly rated hotel and wish I'd stayed at the Four Season!  To me the Four Seasons is the benchmark of service and continually offers a quality experience.  The other hotel did so much on par with the Four Seasons but their restaurant experience for breakfast was disappointing both mornings.  Why take chances when traveling, especially these days?  "
818,"My husband and I stayed here one night for a little R&R. We have stayed at other Four Seasons properties and have always been impressed. Typically we stay at the Peninsula when in the city but decided to give this property a try. We were upgraded to a lakefront suite, which was a nice surprise. The staff were all friendly and welcoming upon check-in. The room was small but tastefully designed. Everything was going well until we realized that there was absolutely no way we were going to get any sleep at night. Apparently something to do with the hydraulics of the building, its tall height and its windy lakefront location come together and cause incessant creaking/crackling sounds all night. There was no sleep to be had. We thought it was strange that turndown service had left"
819,"We have never had the opportunity to stay in a high end hotel in Chicago and the Four Seasons did not disappoint.  From arriving at the curb in a cab the bellman was friendly and very good at his job.  The front desk check in was efficient and we were very excited about an upgraded room to a Lake Michigan view.   We were shown around the spa pool area by a very helpful woman who helped us with slippers and robes while showing us how the lockers worked.  The pool area was not too busy but it was a Sunday night also.  The hot tub was nice and hot, even the pool was not very  chilly.   Breakfast was delightful the next morning and it was nice to relax before heading out to shop on Michigan Ave.   We definitely were spoiled and will be back again. We had a nice relaxing weekend"
820,"We have stayed in Chicago many times, staying at many different hotels. This Four Seasons is my favorite. The comfort, special treatment , perks more than make up for the higher price. There are times I have booked a hotel to save money that has ended up being a nightmare, even in the higher priced chains. Four Seasons has offered my consistent stress free stays. I highly advise a try. It is conveniently located just of the magnificent mile across from Bloomiingdales and near Watertower. "
821,"I stayed at the Four Seasons during NBA All-Star Weekend. The first night of my 5-night stay was sleepless, as noises from plumbing, guests upstairs, and constant creaks from the wind kept me awake all night. Thankfully I had a friend staying at a neighboring hotel and was able to sleep there for my next 4 nights. After night 3, earplugs were left on the nightstand with a note saying that the wind was the root of the problem for the noise. Sorry, I'm not staying at the Four Seasons to wear earplugs in order to sleep.  The restaurant and bar were closed due to renovations, and the pop-up restaurant was in a bland conference room. Again, not something I expect from the Four Seasons. "
822,"The lobby is undergoing significant changes to be brighter and more contemporary.  It’ll be fun to see it when the rest of the lobby, the restaurant and bar renovations are complete.  The friendly and professional service remains unchanged and unparalleled.  From the doormen to housekeeping staff, no hotel in Chicago treats guests better or offers a better stay.  Don’t stay away during the construction."
823,"This hotel didn’t feel like the Four Seasons.   My son kept calling it the One Season :). It’s under construction and there is no bar or restaurant.   But that wasn’t the worst of it all.   Our bathroom shower design left a large puddle of water on the floor after every shower and the plumbing is just old (not much water pressure either).  We complained three times but nothing changed.   The hotel is just old, the building creaks at night (due to wind outside, but still).     Seriously, the stay was really no nicer than a any mid tier hotel.  Based on this experience I don’t think I’d stay at a Four Seasons in general.   BTW, the people working there are very nice and the doormen outside were fantastic, friendly and helpful.   But overall not worth the price with other options"
824,"We have come many times with our children...they absolutely love it! The staff is fantastic and makes the experience. Between the pool, milkshakes in the room, and the local sites to see it is always a memorable experience!"
825,"Our kids first trip to Chicago could not have been better! We booked the Family Fun in the City package and it was fantastic! Make sure you schedule your visit from the Ice Cream man when you book your room because the time slots do fill up. Thank you to all the staff who helped make traveling with our children as memorable as possible! They loved all of the goodies at check-in, the snacks and extras that were waiting for them when we would arrive back after a long day of exploring the city. A special thanks to the concierge team who sent up another stuffed ""Sammy"" after our original Sammy went for a swim in a toilet while attending a show!  The pool is amazing and we had it all to ourselves for an hour or so on a Friday afternoon. My kiddos love the Home Alone movies and it was"
826,"Disappointed to the learn the hotel restaurant and bar were out of commission. I should have been told in advance. I would not have stayed at the Four Seasons if I knew the restaurant was unavailable. Also, when I booked a spa appointment, I had to go through the front desk because the spa was closed for a month and I was booked with an incorrect treatment."
827,"I am currently at the 4S in Chicago and it is undergoing renovation. While the lobby restaurant and bar are being renovated, the service is still excellent as are the food and drinks. The rooms are wonderful. The location on the Magnificent Mile is outstanding."
828,"A really great experience! The people were kind, the room was spacious, the view was beautiful.. right on the Magnificient Mile. It's just one of these hotels you can't stop recommending to your family and your friends visiting the city."
829,"This is my 6th trip to chicago.This was my first stay at four seasons and somehow it didn't live up to its expectations  i think for me the disappointment was the pool ( the main reason i stayed here was for the pool). When i went to swim i saw FOURTEEN kids in the pool at 8pm. the water was mirky, they were consuming food in the poor and after one length , my hands caught some hair and some ""Thing"" else that i couldn't identify. the adults were drinking from glass containers and there was broken glass at one end of the pool edge. I reported this to the spa manager who informed me that it would be taken care of after the pool closed. after that i couldn't actually bring myself to go the pool anymore. i am sorry to say i wont be staying here anymore ."
830,"I want to give this hotel 5 stars but the pool situation with the kids is out of control. I picked this hotel because of the pool and it was over ran with children. They have an adults only time but it’s from like 9pm to 10pm. If I’m in downtown Chicago that’s the last place I’ll be at 9pm. I highly recommend they find a solution or make two adults only times. 1pm-2pm and 9pm-10pm.   The room had an amazing view and the staff was very friendly. Valet parking is expensive so be prepared. The complimentary coffee, got chocolate was outstanding and it’s connected to a shopping plaza so that’s nice. Great location as well. "
831,The hotel has a prime location with breathtaking views. The staff is attentive and purposeful. The rooms  are very well maintained and all the services offered by the hotel are world class. I have stayed in most of the 5 star hotels in Chicago and the Four Seasons is by far the best!
832,Stayed for my daughters annual birthday celebration. This year she is nine. The pool is wonderful. The location is perfect (neighbors of american girl). 900 north shopping and hotel issued discounts to stores makes shopping all the more enjoyable.
833,"The management & staff of FS Chicago exceed our expectations every time. No challenges are too great for the FS team. Our family members , young and old,  consider it our home away from home during the Holidays."
834,"This was our second time staying at the Four Seasons Chicago. We travel to Chicago regularly and we switch back and forth between 4 top hotels depending on availability and price. This time we chose the Four Seasons because our previous stay was memorable, it was disappointing that when we made our reservation we were no informed that the lobby and restaurant are under renovation. It did make our stay less enjoyable, breakfast is only available via Room Service, the food was good but not what we are used to have at the Restaurant. There is a temporary cafe in the lobby area that offers coffee and light bites. Aster Hall in the 900 Michigan Avenue Mall is a great option, you just take the elevator to the 6th floor. Last time the Ice Cream Man made a visit to our room, this time"
835,This is a nice quality hotel with a great location. Four Seasons is always dependable for great service and comfortable rooms. We had a beautiful view of Lake Michigan from our room. The restaurant at the property is solid. We had breakfast here each morning and a couple of lunches. Fantastic service a good food.
836,"We stayed here during a layover on our way to our honeymoon and were upgraded to the Executive Suite. Like most Four Seasons, the room was perfectly maintained and comfortable. I wish we were able to stay for more than one night! The pool and spa were great as well (despite some loud children splashing around), and the breakfast buffet was delicious with a large assortment of options. We will definitely stay here the next time we're in town!"
837,Had the opportunity to stay here one night in December of 2019.  The room was fantastic and I really enjoyed the lake view upgrade.  The pool was great as it had a dedicated lane to swim laps and a welcoming hot tub to soak in after a work out.  The only downside right now is that the hotel does not have an on-site restaurant or bar as it is undergoing renovations.  This was not posted when I made my non-cancellable reservation however the hotel did call prior to my visit to let me know.
838,"The staff at Four Seasons Chicago was attentive, courteous and caring.  From entering the hotel to check-in and check out.  The room was spacious with a great city view and very comfortable.  Large bathroom with double sinks, large tub and shower.  Very clean and comfortable, as usual with Four Seasons.  Had a great friends weekend."
839,"Great staff, great arrival and departure service, over all what you want from 5* lux pro-service on all levels. Will be back for sure during my next travel to Chicago. Note: if you travel with your dog this is the place to stay - the service on this front was worth every dollar. "
840,"We stayed at the Four Seasons for a few nights while in Chicago on vacation.   The hotel is fairly well situated. While we were in Chicago, we visited Willis Tower, Navy Pier, Millennium Park, and the River Walk. None of them are really within walking distance of the hotel, but they're all about a five minute Uber away.  We booked two rooms, which were right next to each other and were mirror images. While the hotel lobby is around about the 7th floor, the rooms start somewhere near the 30th floor, so there really are no low-floor rooms. We had rooms on or around the 40th or so floor, facing back towards the city (rather than the lake). While I expect the view on the other side of the building is better, our 'city view' was nothing to sneeze at. Both rooms were very nicely"
841,Great from start to finish.  Staff was great with kids.  Schedule the ice cream man to visit your family if you can.  The pool was great for the whole family during our stay.  Would recommend this property to anyone.
842," The location of the four seasons hotel is absolutely ideal. The staff is incredibly accommodating and the service is beyond outstanding.  The views of Michigan Avenue, the John Hancock  and the lake make this a truly iconic property. "
843,"You don’t realize what you’re missing in a hotel stay until you visit the Four Seasons.  They anticipated every need I had and needs I didn’t even know I had - like leaving me a really bookmark for my book on my nightstand.  The staff were extremely friendly and go out their way to help out.  We were traveling on business for my husband and received a complimentary upgrade to a beautiful view of Lake Michigan.  The bed was the most comfortable hotel bed I’ve ever slept in!  The fitness room is on the smaller size, working out in the morning I was restricted to only cardio.  There were personal trainers taking up the weights section.  Thank you Four Seasons for providing excellent service and being so friendly, we look forward to future stays!"
844,"First of all, this is a good hotel. I was also upgraded to a suite on the 43 floor and that was stunning. However, overall the hotel feels dated and tired and it a huge disappointment.   It is also annoying to have to get one set of elevators to the 7th floor to get the lobby, and then take a different set to the rooms.   This is an expensive hotel and it is simply not worth the money ..."
845,"Just finishing up our 4 night stay. Overall service levels that one expects from a 4 Seasons are lackjng. No anticipation of the guests needs. Very overpriced for quality provided. Outdated facility that is not up to 5 star standards. 1) Greeting and Checkin-Good. Bags brought up to room quickly and check in fine. 2) Room had a beautiful Lake View but small standard size...not current 5 star standards. Bathroom for wheelchair users an afterthought. Knobs for water on front wall of shower...not handy for wheelchair user on a bench.  Room dimensions small for manevering around. Very loud HVAC---like a low quality hotel. 3) Bar very nice with good service. Comfortable to relax. Cheese plate, wings and cocktails above average. 4)Menu-uninspiring....not current..old fashion"
846,"Perfectly located for shopping and great walks to the lake or down Michigan Avenue. Overall the staff is quite nice and welcoming but the hotel has only one restaurant with a very limited menu if you want to eat healthy foods.  In dining menu is even more limited and prices are very expensive once you add the tax and room service charge. I had to pay $38 for a glass of very bad Cabernet.!! My room was standard and ok but no frills.  I had a massage at the spa, where the reception staff was very kind and helpful but the 50mns massage at $220 was a joke. The masseuse used oils and when I asked about the offered scrub, she said she always does it afterwards?? She only did a small part of my back. And the hot stones? Two stones to massage you with... disappointed.  The worst was at"
847,"In the current day of chrome and glitz, the Four Seasons Hotel stands asa  grand dame of fine living. The ambience of the hotel is supported by the decor with its dark wood and traditional furnishings and enhanced by the attentive and friendly staff both provide an memorable experience. I am relaxed at the Four Seasons Hotel. My partner and I would not think of staying at another property. "
848,"We truly enjoyed our stay at Four Seasons Chicago.  Everyone was amazing, from receptionist at check-in who upgraded our room to suite, to bellboys, concierge, and all other staff that we interacted with.  Dinner at Allium was exceptionally good.  Location is very convenient, right across from Water Tower and above 900 Shops, yet it feel very private.  We would highly recommend this hotel and will be back."
849,"We stay here annually for our 'staycation'. The hotel is in a convenient location and guest rooms are very comfortable. My kids (7 and 5) are always welcomed with a trip to the 'treasure chest' and have a welcome amenity on the beds in our room. This year we had cookies and milk awaiting at our check-in as well. The kids also love the pool and could spend the day there, especially in the winter. Overall it's a great place to stay in Chicago."
850,It was a couple weekend at the hotel with shows and a parade to see. The location of this hotel right off the Mag Mile was perfect. A great room and wonderful service in a beautiful hotel made our weekend a fantastic one.
851,"I always stay at the Four Seasons when available and this was my first stay at the Chicago Four Seasons and it met all of my expectations.  The location was excellent as it was walking distance to two of my three meetings and there are so many great restaurants within walking distance as well.  I had a beautiful lake view suite and as always, everything worked, housekeeping was wonderful, furniture was all in good shape and comfortable."
852,"Nice hotel with a great location a couple blocks north of the Water Tower.  Our high-floor 1BR suite had spectacular views north and east over the lake.  However, parts of the room felt in need of a touch up / renovation (some peeling wallpaper, nicks etc.)  The staff generally provided the usual excellent Four Seasons service, though seating at brunch was limited and service lacking (needing to hunt down the waiter, utensils and foods running out at the buffet, etc).    Overall a nice experience but not enough that I would again pay a premium to the other excellent 5* hotels that are within a few blocks."
853,"Zero complaints. The staff is great throughout, they made my children and I feel very special. The spa, amenities, and atmosphere were a haven from the busy but great city of Chicago. Allium, the restaurant in the hotel, delivered every time with great food and service, especially the cocktails. "
854,"We had a lovely room - full suite with two bathrooms.  The technology in the room trails the Peninsula.  Staff are friendly, but again, just one step behind.  We spent more that 100 nights at Four Seasons in 2019 - Hualalai and Surf Club.  Both of those have staffs that are a bit more on top of things.  Dining is another area this property could use a boost."
855,We are frequent guests here and it never disappoints.   Love going to Allium for pre-dinner cocktails.  Service is attentive but not intrusive.   Kevin enjoys the gym and sauna.  I love that he’s happy being here.  We will be back soon.
856,Excellent service and amenities!  Stayed here for a long anniversary weekend earlier this month.  This hotel will definitely be on our list for the next time we travel to the wondy city.   Spa experience is top notch.
857,"I have been fortunate in my life to stay at many of the finest hotels. The Chicago Four Seasons ranks with the best. It is not glitzy, just comfortably elegant. The room was exceptionally large by city standards and well designed for comfort and business. Housekeeping seemed to go a step beyond. They make their guests feel appreciated, all in an understated way. "
858,Excellent service and a first class property.  Everything was perfect from the valet when I arrived to the checkout process when I left.  My room was clean and spacious and I had a great view!  I'll definitely stay there again. 
859,"Very good hotel, large size room & bathroom located in the heart of the city, downtown. Stayed on 45th floor, view was excellent from there. All major shopping and dining destinations with in 5 minutes walking distance. Didn’t have food there. Staff was courteous enough."
860,"We have stayed at this hotel in the past, and did not have as great of an experience this time. We were promised an upgrade upon check-in, waited an additional few hours for the upgrade, only to be taken to the same room we had booked. The room was not as clean as we expected- the comforter had stains on it and the heat was stuck at 66 degrees. Of course it took us a day to realize the thermostat wasn't working, so we spent quite a bit of time in the cold before having the staff address the problem. Overall, the stay was just average, and wasn't the Four Seasons quality we typically enjoy and expect."
861,"I stayed there for 3 nights and there was not one thing that would need improvement.  This hotel is amazing! The location, staff, cleanliness.... Food was good. The city view is amazing and you just can't go wrong.  It is close to everything you would like to see in Chicago.  I did not want to leave!!! "
862,We had exceptional service. Restaurant always willing to accommodate us as well as the staff.  Hotel is centrally located in the heart of the city. Walking distance to great restaurants.This hotel is our number one pick every time!
863,"Been staying here for years.  The rooms have recently been upgraded.  The executive suite looked fantastic and was very functional.  Desk is gone and replaced with a table and chairs.  Service as usual was top notch. Room service was excellent.  Nice pool and gym.  Parking, though, is steep--70 dollars a night."
864,"I booked a 4 day sightseeing trip with my 12 year old niece and the Four Seasons made the trip even more memorable for her by giving her cute little gifts each day and by the concierge giving us such great recommendations on where to go and what to see.   The room was perfect. Very spacious with a Great Lake view. Room service and housekeeping were top notch. Excellent turn down service every evening.   Special thanks to the night manager, Raul Ibarra, who showed great kindness and professionalism when I had a dispute with my credit card company. It was not the Four Season’s fault but he stepped up to make it right and I really appreciated it. "
865,"Always have a superb experience at this hotel. From the bellhop staff to the housekeeping to the front desk, I am made to feel like royalty.  I try to make this the hotel I stay at when I'm in Chicago for business or pleasure. "
866,Awesome service!  Greeting personally at desk.  Room service On Time and hot! Great gym and pool area.  Great location in Chicago connected to inside shopping mall. Restaurant food very good though could use greater variety of entrees. 
867,Four Seasons Chicago a peak experience. The accommodations and hospitality unsurpassed! The lobby bar really lovely and the menu was great. Sunday brunch so elegant. The service on point and the staff so generous helpful. The accommodation s so comfortable. I can’t wait to return to the Windy City and the Four Season’s will be my destination of choice.
868,My wife and I were at the hotel recently for a wedding of a close friend. One word - Outstanding! Everything from arrival to departure was perfect. Best place to experience a wedding that you get to enjoy. We have our youngest daughter getting married next year and this gave us some wonderful ideas.
869,"Love this hotel, it was quite an experience.  We went for our anniversary as a stay-cation and to relax at the spa.  The location is great. Everything you could possibly need is right there.  The pool, hot tub, and saunas are great.  Hotel staff is friendly and accommodating.  Great for business travel or couples get-a-way, or even a family/friends vacation."
870,The Four Seasons is secluded yet assessable to everything you want to do in Chicago.  The staff was courteous and friendly.  We loved the  entire experience.  The hotel room was totally equipped with anything one could need.  The restaurant for breakfast was delicious and offered many great choices. The people were friendly and helpful. 
871,Best value at the luxury end. Have stayed at all the top hotels and the Four Seasons is more fairly priced. Breakfast is pricey but there are lots of good options in the neighborhood. Concierge was super helpful.
872,"My first and only stay (until now) at this Four Seasons was a number of decades ago, probably before the internet's debut.  A horrific experience with a horrific front desk staffer at both check-in and check-out, plus the hotel's non-response to my written complaint (this was back when guest surveys were completed on paper and mailed), kept me away from the Four Seasons in the ensuing years, during which time I would stay most frequently at the Ritz Carlton (which was then a Four Seasons hotel as well), the Langham (in Mies van der Rohe's IBM Building), and the Hotel Burnham (now the Staypineapple) in the historic Reliance Building in the Loop.  I was enticed back to the Four Seasons for this trip by a great rate offered by my Chicago-based professional association.  I'm happy"
873,"We love to come to Chicago for special birthdays or occasions. Our favorite hotel by far is the Four Seasons. The staff, the food, everything is first rate. The sleeping accommodations are amazing! Every experience is executed with such care. "
874,"Fantastic location, clean, well maintained, okay it could do with a brightening up job but the helpful staff certainly made up for it.  The concierge ladies couldn't do enough for us and were there the next day to check everything had gone to plan, normally you use the concierge desk and never see the same people again but these girls remembered everything they had done for us and made sure we were happy.  Great room fab view, check in desk very professional and pleasant, doormen great, I love a doorman with personality and these guys definitely had that."
