,reviews
388,"Let's make this crisp and easy to absorb:  1. The rooms are supposed to have bathrobes. It's on the housekeeping inventory. If they're not there when I check in, I will mention it so that I am not charged for pilfering. If on subsequent days they're still not in the rooms, I will determine that there is a communications issue between housekeeping and the front desk. Or a systemic issue of Not Giving a Fig.  2. Why is the a/c not cooling between midnight and 3AM? Every night.  3. Why isn't anyone responding to multiple requests to see why the a/c is not cooling between midnight and 3AM?  4. In room dining: Forgetting utensils. Forgetting catsup despite requesting it. Twice. Old, cold french fries. Wrong burger sent. Salmon barely cooked-slimy and slick inside and I value my"
389,"This is absolutely a fantastic hotel, but it's not a true five star hotel. The bell staff at the door is helpful, but not as helpful as they could be. The reception staff are helpful, but not too helpful.  The reception is on the 20th floor, but the rooms are below the reception. The lobby has a beautiful view, but it was not terribly inviting. The restaurant on the 20th floor had breakfast for Hilton elite members, but I was made to feel like a second class citizen for partaking in it, and it was a relatively poor continental breakfast. I would much rather receive a credit for the restaurant than a continental breakfast that the waitstaff judge you for ordering.  I received an ""upgrade"" to a Michigan Avenue facing room on the 16th floor. The room was very well appointed, the"
390,"Overall this is a very nice looking hotel but the service is definitely subpar. I recently stayed with my wife and I am a Hilton Honors Diamond member but this property does not give any value to tier status.   At the time of checkin, they were unable to offer a same day upgrade or even a high floor room. The server at the bar was extremely rude to myself as well as our friends we brought to the hotel for drinks. They offer free breakfast for Diamond members however this is a TERRIBLE breakfast. The breakfast only includes mini pastries, milk, cereal, etc. We asked if we could upgrade and pay a difference, however, that was not an allowed option so we purchased the alternate hot breakfast at full menu price. We also asked for late check out on the day of our checkout and were"
391,Came to celebrate my husband’s birthday and thanksgiving  We have spent 30 minutes to discover the valet weren’t in their spot with no room to leave our car. They have double booked us And the room is nelly and full of dust Not a proper happy birthday welcome  Certainly not a 5 star hotel service
392,We were so pleased with the treatment by the hotel staff.  We felt like valued customers.  From the moment we went to the 20th floor we felt welcomed.  Never had to open to door to come in the building or leave for the day.
393,"This is a newly Conrad Hotel in Chicago for several years now.  It's a very nice hotel and good for work-related functions - Save place to rest, good shower, warm room, comfortable bed.  I had stayed here several times whenever I traveled to Chicago for work. I enjoyed the breakfast restaurant but it could be improved.  The room was small for the amount of money paid.  I don't think it was value-added given my status with Hilton hotel.  I don't recommend this hotel unless you are desperate to find a luxurious hotel to stay at in high season.  The staffs here should be educated to learn more about what it is like to work at a high-end hotel.  The staffs sometime could be clueless, unimaginative, and entitled."
394,"Pros:  Modern hotel, Great bar; especially bartender Zak, another Conrad bear to add to the ever-growing collection.  Cons:  Where to start?  Overall, hotel is not worthy of the “Conrad” name.  terrible service, front desk staff rude and accuses guests of lying, no sincere Diamond benefits, hotel nickels and dimes guests.  Detailed:  We arrived at the Conrad Chicago late Friday evening for a two-night stay.  We visit Chicago several times a year and typically stay the Palmer House which is another Hilton property.  We decided to try the Conrad as we have had wonderful experiences at all the other Conrad’s we have previously stayed at.   The door staff were polite and let the front desk staff know of our impending arrival.  Front desk staff was pleasant at check in; however,"
395,"Good experience other than hearing some noise from a room next door. Staff took care of it. Nice toiletries, plenty of storage space, nice views, good location, friendly staff, classy decor. I would return and recommend this place to others."
396,Excellence Is the best word I can use to describe Conrad! I’ve stayed at several hotels in Chicago and this one stands out!! I look forward to my next visit! Now the new giant Starbucks Reserve is right next door! 
397,My first experience with the Conrad Chicago. Very nice room at a fair price in a great location. Friendly and welcoming staff. Only stayed one night this time. Will definitely stay there again next time I’m in Chicago.
398,"You can never go wrong with a Conrad. And the staff here are really on top of things. Had a standard king room this time but standard here is quite satisfactory. I’m picky about bathrooms and I love their bathrooms. I’ve stayed in a skyline suite here, and if you get the chance, you should. It’s a great view, a beautiful room(s) and nicer than my apartment."
399,"The arrival process went so smooth...and we didn’t get in until 1 am! The room service was excellent and we used it at least once a day for convenience and it’s quick delivery. I loved our view, the room was fantastic and the key pad used to put our room on private, call for tray pick up, have our room made up, etc. was so nice. They even texted us two different days to see if we needed anything for our room since we had our room on private/do not disturb. We will MOST DEFINITELY be back again. "
400,"Luckily I only stayed one night.   Front desk attention and service was great, but the overall style of the hotel is outdated and old. The carpets in the rooms need to be changed ASAP, the shower/bathroom area was quite small, it felt almost European. The bed was comfortable, as were the pillows.   Had breakfast at the restaurant downstairs and it was rather disappointing, the food wasn’t good.   On the other hand the location is pretty great."
401,"Celebrated my birthday in Chicago and decided to stay at this hotel. Had a wonderful experience from Check in to check out. Received a room upgrade that had stunning views of Millenium Park! The door man, Barry was awesome! He helped answer any question about where to go and how to get there. Always had a smile on. "
402,"We always have great luck at Fairmont’s but not this time. The furniture in the rooms and the bathrooms felt very dated. No coffee maker, no house keeping unless you ask for it, no parking on site and only two pillows on a king bed (so 1 pillow each). I get it, covid precautions but this just seems excessive. I couldn’t get out of there fast enough. We left and checked in to Trump International the very next morning. They had all the amenities I expect when traveling. "
403,"This hotel will not disappoint you. I had my room upgraded to the gold room.  Which I had met the 4 amazing people in my life.  They did not make you feel like a guest. So much more like family. Alexander Mcandrews, Mandana Kaydi, and Tiphani. They had the best hospitality in the world. They make you never want to leave the Fairmont chicago. Also huge shout out to Cody an amazing sweet person also. Make sure you say hi to them and for sure you will feel the same way I do as soon as you meet them."
404,"I stayed 4 nights in June 2018 while attending SHRM18 Chicago. The hotel was beautiful! My room had an amazing view that faced the pier/lake as well as far north downtown. It was in walking distance to many neat attarctions and dining. The marble spa styled bathroom included was amazing! There is not a pool on site, and parking is undergound, but i would definitely return. I had the best time, and did not want to leave!"
405,"My suite overlooked Millenium Park, which was a short walk out the main door. Every inch of the hotel was clean and modern. Friendly, efficient staff at every interaction. Delicious food spanning many kinds of cuisine across the length of my conference. Thoughtful amenities like a light-up makeup mirror and shoe cleaning station really enhanced the room experience. The public lounge areas were also spacious and comfortable to grab a few minutes of laptop or phone work or just to gaze at the city views. A hotel that manages to maintain both a sense of vintage history and gilded modernity that makes for a perfect stay."
406,Wonderful stay.  Luxurious hotel without being pretentious.  Combination of comfort and style.  The staff was courteous and available without being noticeable.  Location can't be beat.  Amenities are second to none.  Can't wait to come back!
407,"Excellent staff - very friendly and helpful - and great accommodations. I was surprised at how well laid out the room was, and it didn't feel cramped like most city hotels. Also, the food was excellent at the restaurant, the room service, and the events held at the hotel. What more can you ask for?"
408,"My stay was seamless from start to finish.  The hotel was in great shape, staff was kind, and operations ran smoothly and without a hitch.  Fairmont has once again proven that they are the best of the best!"
409,"Hotel lobby and restaurant are nice and swanky.  The overall quality of guest rooms, hallways, bathrooms have room for improvement.  The concierge, Gail Walker, is on top of her game, always remembered us and gave very helpful recommendations!  "
410,"Had a 2 night stay here with my sister, and loved it! The room was gorgeous, we had a corner suite, and everything was extremely clean, modern, and elegant looking. Turndown service was provided, even though we didn't request it, and it was lovely! The staff were very pleasant and helpful, and I loved the feel of the lobby. The location of the hotel is also absolutely ideal - it's central to everything, and I felt very safe the whole time.  On our first night, we had an issue with the room next door who decided it was a good idea to throw a loud room party late into the evening/morning. Having just got off an 8-hour flight, we were very tired, and so called reception to see what was happening. 5 minutes later, staff immediately came to see to the room next door and resolve the"
411,Our room was lovely and large. We had a suite that included 2 beds and a separate room with a pullout couch and table. The view was great. A little bit of the city to the right and straight ahead was the lake. All staff was very friendly and helpful.  Awesome stay. I will return.
412,I loved being within walking distance to Millenium Park and the Art Institute of Chicago. Alexander at the front desk was especially helpful with local coffee shop and nearby shopping recommendations.
413,"Great hotel with nice accommodation. Staff very accommodating and pleasant. Nicer than normal gym. Great location in the heart of Chicago. Very clean and spacious rooms.Bathrooms, slippers and umbrellas supplied!"
414,Stayed at this hotel for a conference.   The guest rooms were much nicer than I expected for the group rate that I paid.   Bedding was very comfortable and the bathrooms were a nice size for a downtown hotel.  Staff was friendly throughout my stay.
415,"amazing locations, great views -  we stayed at 38th floor and it was amazing, the booking through Booking.com was a bit messy but it may be caused by booking .com  staff were helpfull and all very great experience, overall"
416,Could not check in at 5PM. When I checked in at 7PM could not get my luggage. An other 20 minutes of waiting and more frustration. To top it all off no lounge access for Diamond accor member. They really do everything possible to not make you feel welcome. Maybe its because Im not from USA so they look down on me. My conclusion please avoid this hotel by any means!!!
417,We recently got an invite to the black tie opening for the Chicago auto show. After enjoying endless food and drink and many beautiful cars that you could actually sit in.  We chose to stay at the nearby Fairmont Hotel.  We stayed on the gold level 15th floor. Which has a delicious hot breakfast and a light dinner included with the room at an affordable price.   The view was fantastic and the bed was even better.   We live in the greatest city in the world.
418,"Farimont Gold staff and lounge experience was outstanding, hotel well located, clean and welcoming, if a bit dated in some of the decor. Very much appreciated the quick check-in and check-out and really very friendly staff."
419,"Very nice hotel in a great location.  We walked everywhere and it was located right in the heart of the action.  Easy check-in and lovely room.  Upon leaving, we left our bag with bell captain and it was again very easy."
420,The hotel was very accommodating to the conference I attended.  The housekeeping staff did a great job of keeping my room fully supplied and clean.  Appreciate them.  The rooms and beds were comfortable.  I enjoyed having 24 hour access to the fitness center as well.  I would stay here on a return trip either professional or personal.
421,"Loved the rooms, friendly helpful staff, concierge was really great. definitely recommend!!! The rooms are really large and love the stone tile in the bathroom. Such a great value for the money in January."
422,"I’ve stayed here 10 or so times now since I visit Chicago a lot. There is nothing horrible about the hotel, it has just become very run down. The elevator today had the call box door broken and hanging open. The carpets in the rooms are worn, and there are scuffed walls everywhere. You can see the photo of my room. It looks like a roadside inn.   The people are lovely and friendly, and it is in a great location. Just don’t kid yourself that this is a luxury hotel. It is far from it. "
423,"Had a brief stay here on business. Check in was a breeze despite late arrival. Room was pleasant, feels like an old school Ritz (separate shower bath and a door that closes for toilet). Room was reasonably spacious as well. Location can’t be beat. Didn’t do much to test the customer service or housekeeping since it was a one day stay, but would come again."
424,"The hotel is located in Chicago Downtown, very close to Millenium Park where the Bean (Cloud Gate) is located. A couple minutes walking you will reach the reach the Chicago riverwalk and the Michigan Avenue (the Magnificent Mile). The people are friendly, the service is good, and also it was safe walking around the area at night. All in all it was a good experience. If you need breakfast, there's a Deli called Bockwinkel's just behind the hotel open from 7AM. The sandwiches are good.  Warning: for people from South East Asia region, who are used to the 5-star experiences in hotels throughout SEA, you will find yourself comparing the services and the amenities. My suggestion is, DON'T. Different customs, just enjoy the location and the friendliness of the staff,"
425,This was the second year our group was at the hotel and it was another fantastic experience.  The banquets and events team are top notch and the food was yet again another hit with everyone who attended.  I am sure we'll be back next year.
426,"I’m always on the hunt for good skin services. Living in the city, my skin gets rough and clogged from all the environmental factors. Couple being someone someone with sensitive skin, I struggle to find someone whose able to give me an effective facial without leaving my skin red and irritated. Alexis is a skincare angel sent from above! She was incredibly educated on all the products used and easily swapped out products that she suspected would irritate my skin. Not only was my skin irritation free at the end of my visit, but I kept getting compliments on how clear, glowy, and glass-like my skin looked afterwards. I immediately booked another appointment with Alexis!!"
427,"My wife and I enjoyed a three day’s stay at the Fairmont Millennium Park in Chicago. We upgraded to the Gold level, and it was more than worth it! All staff members and management were outstanding. And access to Millenium Park as well as the rest of downtown Chicago makes this a great place to stay when exploring the Windy City. Thanks to all of you, and we are looking forward to our next visit!"
428,Everything was amazing about the stay - I received an unexpected upgrade to a suite. The space was luxurious and the bed was so comfortable. I also enjoyed the Le Labo toiletries and the tea selection. The staff was incredibly friendly and helpful - they made me feel welcomed and valued during my stay. 
429,Another great stay at the Fairmont Chicago.  Special thanks to Mugi and the Reception Staff as well as Patrick and. Gold Lounge Staff for attending to all the details !  Knowing my preferences for my stays is big factor in why I return and will continue to do so.  
430,"I have stayed at this hotel the last 3 times I have visited Chicago and have never been disappointed.  This trip we had an issue shortly after checking in, which was no fault of the hotel or their staff.  The people in the neighbouring room decided to smoke marijuana in their room shortly after arriving, which created a strong odour in our room.  A smell our daughter could not tolerate. We went down to the front desk on our way out for the evening and although we didn’t want to make a fuss, Hyon at the front desk handled our concerns perfectly.  Not only was she extremely sympathetic to our concerns she provide us with several acceptable options to address our concerns.    On top of the excellent customer service provided by Hyon and all other staff we have encountered on our"
431,Traveling on a road trip we stopped in Chicago and stayed a night at the Fairmont.  Great rates and the gold rooms are worth the extra charge. The gold lounge was great and had wonderful views of the city.  
432,"We stayed at the Fairmont Millennium Park for three nights around the Christmas Holiday.  The location was very convenient to a number of attractions in Downtown Chicago, including the ice skating ribbon at Maggie Daley Park, Christkindl, the River Walk, The Art Institute as well as shopping on State Street and Michigan Avenue.  One minor issue is that while the area is busy during the day, there is pretty limited foot traffic around the hotel at night so we typically took Uber back at night rather than walking.  Our Gold Room was clean and spacious and the Gold Lounge had a wonderful breakfast and other snacks throughout the day.  I particularly appreciated the service by Hyon at the front desk, who made check in a breeze and went above and beyond to ensure that we enjoyed our"
433,"I've spent one night on a business trip. I arrived late at night, and the reception personnel was accommodating and friendly. The room was upgraded to a beautiful room. I will return, a great location and view."
434,We stayed here for an event at Millennium Park. The location is perfect since it's right across from the park on the north side.  The room is larger than normal. The bathroom has a big tub and decent sized shower. The bed is very comfy. We felt like we were sleeping on clouds.  Would definitely come back and stay here again.
435,a great place to come home to- the gold floor lounge spoiled my 4 year old granddaughter rotten; the conciere in the lounge was extremely helpful and knowledgeable with reservations and best times to go to the different venues - nice!
436,Our family stayed on the Gold Floor for the week of Christmas and had a wonderful time! The hospitality that Mandana shared each day made our week special! Mandana is a true representative of the Fairmont culture!
437,"From the moment we were greeted by Nino at Fairmont hotel in Chicago, to our room, to the champagne and chocolate covered strawberries...everything has been amazing. Special thanks to Gail the concierge who helped us with different recommendations on food and entertainment in Chicago. Everything and everyone was wonderful!"
438,"What happened to this once beautiful and lovely hotel?!?! We stayed for a night and the hotel was decked out for the holidays. But, there was no holiday spirit. The front desk personnel were void of personality and only wanted to work the computer system. Escalators were turned off.  There was no welcoming atmosphere that you would expect from such a “luxury” hotel.   We went to the hotel restaurant and were promptly seated. We waited 20 minutes and were only acknowledged once we got up to leave for the hotel restaurant (Filini) across the street. And, the restaurant personnel looked right at us after we were seated. Our room had (what we guessed) was the hotel cleaning crew's hair on our toilet seat and in the bathroom sink. AND...we were charged a ""amenity"" fee of $20. When I"
439,Fantastic amenities.  The spa is a truly wonderful thing. The staff was exceptional.  Vitaly and Melissa were fabulous.   I enjoyed my seaweed wrap with Vitaly and waxing with Melissa. Check in and check out was great too. Just a wonderful end to a long business trip.
440,"From the moment we arrive the staff was friendly and outgoing. The hotel is in a great location and the room was perfect for our stay. If possible, I will always stay at a Fairmont! The Gold Lounge is a real treat. "
441,"The Fairmont is primarily a business hotel during the week so it was nice and quiet for our Saturday night stay.   We checked in early which we really appreciated.  The person who checked us in was very nice.  The room was very nice, clean and a good size.   We were upgraded to a room with a better view, also a nice touch.  The only negative was no mini fridge so there was no place to store our leftovers.   Also, the restaurant  service was not the greatest.   Personnel was inexperienced and it took a long time to get our food.   Also, they advertised a brunch but it was not being served that day.   The management needs to do a better job for the guests using the restaurant. "
442,"From the arrival hello by the doorman , Harry,  till his final goodbye, staying at the millennium was purely magical. Very attentive staff, beautifully appointed rooms, quiet and peaceful and yet right in the very energetic heart of downtown Chicago. How much more connected can one be?"
443,"Great view of city and lake, close to millennium park, attentive and well trained staff, easy walk to mag mile shopping and restaurants, a few minor details like towels and linens could be updated, good fitness center "
444,"Classy hotel on an excellent location. Spaceous rooms and hallways, excellent service. Service and quality according to room rate. Columbus tap is a nice bar, but lobbu bar shouls also be opened most of the time."
445,"My husband decided to pay for gold lounge upgrade for our anniversary stay this past weekend. While it was a nice perk, there ended up being several glaring negatives.   First, we had asked for a quiet room far from the elevators- which was true, for the guest elevators, but unknown to us we were placed almost directly across from the service room and we were woken up at ~6am with tremendous clamor/noise/plate clanking. We went out into the hallway to find it was the staff setting up breakfast! Not exactly the restful sleep you want for a celebratory weekend, and this just set the tone for the rest of the morning.  Next, the gold lounge has a ""write down your room number for alcoholic beverages"" as an honor policy system.. .both my husband and I did not drink alcohol at the"
446,"The Fairmont in Chicago is all you would expect from a Fairmont.  Service is great, rooms are excellent and location is perfect.  Great place to stay if you need a downtown hotel.  Millenium Park across the street and water views are a real plus."
447,"Very convenient to Aon Center. Rooms are modern, well kept and comfortable. Concierge lounge on 15th floor had an excellent array of food and beverages throughout the day. Hotel staff was personable, attentive and helpful for all requests. Thank you Fairmont Chicago for an excellent stay. "
448,I adored this hotel.  Everyone was the perfect combination of professional but welcoming.  I was here for a conference and the conference services were outstanding as well.  I'd come back in a minute.  Perfect location to walk everywhere too.
449,"Location can't be beat. Being so close to the best attractions in the Loop such as Grant Park, Magnificent Mile, and the river gives you access to countless things to do. I thought the room was very clean and comfortable and I would stay again."
450,"Very comfortable home away from home, but a little pricey with the food and in room refreshments.  Normally would book at a different hotel, but overall experience was good.  The staff was very welcoming and room was clean."
451,"Stayed for three nights; very big hotel but friendly staff at check-in and my room was of a good size with a big bathroom, good shower and comfy bed. All very clean and well presented. Disappointed that no swimming pool in a hotel of this size and the fitness area is underwhelming.  More Holiday Inn than what I'd expect from a Fairmont. Good bar/pub in the lobby.  Nice beers, friendly staff.  Colleague ate and said it was good.  Would stay again."
