,reviews
0,"We had a great stay! The location was convenient to everything! We found a great place for breakfast nearby (Yolk). The corner king room had a great view. Staff was excellent- Michelle was great and so helpful. When we come back, we will stay here again."
1,"My parents came to this hotel in August because I was having a family reunion at home and it was too small to accommodate them, I would like to thank the staff for their kindness and for having met the expectations of my parents, they loved their stay with you, beautiful room with all the comfort they needed, excellent breakfast, thank you"
2,"The staff was amazing and offered such great advice on tours and food options.  The hotel is perfectly located for a lot of walking options.  A ton of wonderful restaurants within a block or two.  Shopping was close by as well.  The only drawback and it’s minor, which comes from my builder husband, was they should fix the poor job of wallpapering in the bathroom.  Too late to fix, but may we suggest doing it over with a better company.  They did not do your hotel justice.  It’s evident in other areas the upgrades were spared no expense.  Just a suggestion.  By no means would this keep us from coming back!"
3,"We stayed at the kinzie this past weekend and we were greeted by Arturo Garza. He was one the the most genuine and nicest person I’ve yet encounter at a hotel. He was extremely helpful with local restaurants, things to do, and even suggested a few of his favorite spots to visit. This experience made my stay more enjoyable and I was more welcomed into the city. Thank you for everything Arturo!  Highly recommend"
4,"The staff was very welcoming from walking through the doors. The suite, omg, the pictures are nothing compared. It was beautiful and we will definitely be back. Thank you for the hospitality and the breakfast"
5,"It was the first time my friends and I stayed at the Kinzie Hotel and we were so happy Arturo took such good care of us. Arturo made our check-in process very easy and was cheerful through out the whole process. He also explained to us about the Happy Hour the hotel offers, and he brought us some cute little wine bottles we had picked from the variety he offered from. Arturo made us feel delighted when we were around him, very nice hotel and excellent service!  Definitely coming back soon! "
6,"I had the pleasure of staying at the Kinzie hotel while waiting on my apartment to be ready. I would like to say the front desk guy Nico was soo pleasant and amazing. He accommodated next with everything i needed, everytime i entered he gave me a warm welcome and a sense of feeling wanted.. Also there was a very nice young lady with curly hair who assisted me when i needed to extent my trip an extra day. Overall everything was perfect, clean, and neat. Will visit again one day and you can thank Nico and the nice lady with curly hair(sorry forgot your name) at the desk."
7,"We were very pleased with our stay at the Hotel. Theas very cozy, clean and comfortable. We truly enjoyed the large tube, only wishing the shower had an attachment because of my height 😊. The staff Arturo Garza was very, professional, friendly, engaging and patient, he really made feel welcome. I would definitely recommend this Hotel to all my friends and family."
8,"Great Hotel in the middle of Everything, Great Rooms, ( I had a suite), it was one of the best views of the city , I have ever had, Great , Great , Great.Walking Distance to Great Restaurants and Shopping. Evening Reception with Free , yes I said Free Wine was Great."
9,"This would be a nice hotel if it were 3 stars, but rating it as a four star hotel is unrealistic.  Our room was had mold on growing on ceiling.  The walls were banged up.  It’s definitely in need of some repairs.  The location is fabulous.  The staff were kind and courteous.  However there wasn’t enough staff.  With only one staff member, there was a long wait to check in on a Monday afternoon.  The wait to get my car was even longer the next day, at least 20 minutes.  Over $70 a day to park and with such a long wait, we should have just parked it ourselves.  The city view should be called a street view, as the building is so much lower than the others you don’t see much except for the street below and 1-2 buildings.  It’s not a bad place, just not a great place either.  "
10,"Everything was perfect, nice staff, great view, great location, TV had Netflix. Great restaurants we’re in walking distance, close walk to a great mall, navy pier was close as well. Really peaceful stay and me and the wife definitely will be back soon"
11,Great place to stay in downtown Chicago. Across from an iconic restaurant and near lake shore drive. The staff was excellent especially Michelle. She went over and above to make sure we were welcome and appreciated. Room was cool and clean. Thank you so much we will be back
12,"The Hotel has an AWFUL customer service, I did my checkout and on my way to the airport I notice I forgot my Apple Watch and reported to a staff member Andrew who the only thing he did was send me link to report the item, which I did and attached a picture of the Find my iPhone show where it was and was easy to find because it receives calls, they refused to check the room while the Apple Watch still had battery, they notify me the next day that they did not find my watch. Let me tell you I’ve stay in not good looking room but staff more customer service related.  The watch disappear even with pictures of location during several hours and it can not be found. Shame. Besides that they only clean your room if you’re out before 8am, forget the experience of vacation waking up later"
13,"Wasn't sure what to expect during this unusual summer, but this place was better than expected. We had a suite, with amazing windows floor to ceiling.  We checked in early a couple of hours without any hassle. Did not try the ""to go""breakfast, but did enjoy the ""happy hour"" wine. Great location on a semi-quiet street. Easy walk to the Riverwalk, Michigan Ave, and Millenium Park. Also, the price for a suite was lower than a standard room at most of the other nice hotels in the area. Also, lady at front desk told us about ""spot hero"" app that saved us $50 on parking. Great deal!"
14,"Its really clean, modern and upscale. Its smaller so it feels like a nice boutique hotel, yet it feels like it has the standard of an amazing high end large hotel chain. I was also surprised that we had a view overlooking a really cool outdoor patio. Its right next to amazing upscale restaurants with outdoor patios. This is a good hotel for tourism, business or anything! They gave us big bottles of wine at check in so that was cool, too!"
15,"My friends and I took a quick trip to Chicago to celebrate my birthday! The Kinzie Hotel was the perfect hotel for all of our needs. The staff was very hospitable, helped my friends surprise me by hiding cake and Party needs. Our accommodations were perfect for our weekend away. We felt very safe and secure given the COVID19 life we all live now. The Kinzie Hotel provides services at your leisure while also reducing risk. Andrew the manager provided a great guide on how to enhance your stay while also feeling like your healthy and safety are priority! Oh & best of all the location is perfect for sight seeing, dining and outdoor experiences ! You won’t be disappointed! The rooms are clean , modern, and provide great Chicago views! Oh and they have a cool photo booth in the lobby"
16,"Amazing. The place was clean, the staff was prompt, the location was in the middle of everything that we needed to get to. I was very grateful for the working crew and positive energy that we were treated with."
17,"I used to stay at another hotel in the area but it was full. I was getting tired of that place anyway because they were overcharging for what should be affordable rooms. I guess I had an Idea of what affordable looked like for near the Loop and expected the same sort of space from Kinzie because the price was close. The room at Kinzie exceeded these expectations; windows, amenities, coffee pods and robust WiFI, but also the desk staff treated me like I was some sort of VIP. The staff immediately read my situation when I arrived (tired, hungry, barely social or communicative) there was some sort of glitch with my reservation because I used an app that was being weird. They were bright and cheerful and made me feel comfortable as they quickly accommodated. I opted to pay for"
18,"We really enjoyed our stay in Chicago, even though it was for a short time. The Kinzie Hotel was very clean, had beautiful views, and great light cancelling shades. Michelle at the front desk was so helpful and welcoming! She is a gem of an employee!"
19,My 35th bday. Amazing Staff Very Professional and Kind. Breakfast section is awesome and healthy choice. Will definitely repeat business here. Thanks Kinzie Hotel. Love the theme lobby as well. Great security after hours too.
20,"My room was small but nice. The bathroom could have been a little cleaner but I'll chalk that up to COVID-19 and social distancing.  I had a view of Kinzie Street as well as the Trump Hotel after I requested a high floor with a view. The staff was very friendly and informative, all except the valet which seem to take at least 30 mins and cost $73 a night which was almost the price of my room! That being said, I had a decent stay in downtown Chicago for a fairly low price!!"
21,This hotel accepted to cancel our reservation without fee due to the current sanitary situation while we had not booked with a cancellation facility. THANK YOU VERY MUCH Kinzie Hotel !! Next time in Chicago we visit you !
22,"My friend booked a room at the Kinzie Hotel for business and decided to have me over for dinner. I went to the front desk to ask if there was water to purchase. Raul Villarreal was very helpful and even gave some recommendations for some things to visit in the area. All in all, his hospitality and warm smile made the stay even that much better. Thanks Raul!"
23,"I just want to take a minute and shout out Raul Villarreal! He was very accommodating and helpful at the front desk, when I had some specific questions about the area. Because of his hospitality alone, I’ll definitely consider rebooking at the Kinzie Hotel."
24,"We have been trying out different boutique hotels in Chicago over the past year or so, and this was one of the nicest we’ve stayed at. We had a corner suite, and it was well laid out, furnished very nicely, floor to ceiling windows with electronic drapes, and very intimate and luxurious. The front desk staff here are stellar at their jobs, especially Lexy and Lupe!! They truly are two of the most friendly and welcoming desk staff I’ve encountered in many years of staying in hotels. Andrew, the GM, also was very welcoming and genuinely wanted our anniversary there to be special. The Kinzie Hotel truly is a “diamond in the rough”, and I highly recommend it for anyone looking for an intimate, well appointed boutique hotel, in a great location, in Chicago. Looking forward to"
25,"Family business required that my wife and I travel to Chicago for the weekend. In spite of the fact that the city is largely shut down, and the hotels that are open are very limited in terms of the amenities they can offer, the Kinzie was such a nice positive experience. Extremely friendly and accommodating staff, great rooms – wonderful floor to ceiling windows with a nice chaise lounge to sit and watch the city rest – great location, great vibe. We will definitely return!"
26,"Our stay at the Kinzie Hotel was absolutely perfect! From the moment we checked in, everything and everyone was incredible. A great location, an exceptionally clean room and friendly, helpful staff make this an obvious choice for anyone traveling to Chicago. Highly recommended!!!"
27,"We have stayed here a number of times when we come to town for Blackhawk games, the theater, or just to get away. The cost, the location, and the friendliness of the staff are exceptional (Mona and Derrick). If you are a walker, it is very easy to  walk to attractions both north and south. The continental breakfast is more than enough to send one out for the day, and the wine/beer in the evening is a plus. Then, too, the discount at the Public House next door is great for a drink or light meal. Parking fees are steep, but they can be reduced by using Spot Hero for nearby parking garages if you don't want to go in and out."
28,We loved our stay st the Kinzie Hotel. Perfect location. Close walk to so much. Rooms are clean and spacious. Fun complimentary hour hour and breakfast. Especially great bellman Derrick in the morning and Alex in the evening. Highly recommend and we've found where we'll stay from now on!
29,"We stayed at the Kinzie hotel from March 2 through March 7. Martin, the hotel manager, went out of his way to accommodate us with our requested room. Service was outstanding from every employee; doorman, housekeeping, front desk, bartender, and even the maintenance person. Location couldn’t be better. I loved the layout of the room with a long desk bar in the bedroom and a full countertop in the bathroom (no lousy non-functional decorative pedestal sinks in this hotel). An empty refrigerator was available in the room, perfect for in room beverages. We’ve stayed here multiple times and look forward to returning. "
30,"Cozy and stylish room! Appreciated the extra things offered in the room, especially for getting ready. LOVED the complimentary happy hour! The only thing I wasn’t a fan of was our view. 😕 Great location to restaurants, bars, music venues, and shopping!"
31,"I've traveled all over the world and stayed at some of the best hotels. I didn't know what to expect when I booked a room at Kinzie Hotel. Not only was my greeting upon arrival and check-in pleasant and easy, the room was modern, clean and pretty cool! Bathroom and fixtures were well done. Strong shower. Ordered room service and had one of the best salads of my life! I admired the pens in the room and upon checkout asked if I could have a couple...the fellow ran out and secured me a few to take with me. Great location and a great stay. I was pleasantly surprised and will recommend Kinzie Hotel to friends and family visiting me in Chicago."
32,"I very much enjoyed my stay at the Kinzie Hotel. From the ""informal"" lobby full of friendly staff to the generous rooms with lots of natural light, this hotel offers a great atmosphere. The continental breakfast and cocktail hour were much better than what is offered in more standard ""chain"" hotels. The location was convenient to meetings I had in the Loop, even walkable in some cases. I highly recommend this option and will definitely return!"
33,"Spent two nights here over the weekend. Excellent location and easy to find. Lovely, friendly staff and a quirky design. Rooms are clean and fresh and the bed was super comfy. Loved the complimentary breakfast and happy hour. Looking forward to returning in April, June, July and September!"
34,"I was greeted by friendly staff, stayed in a very modern and comfortable room, and enjoyed a tasty breakfast the next morning. Other perks were easy check out, text communication with the concierge, and a happy hour for all guests.  Would recommend this hotel to others and will absolutely stay here again."
35,"Great hotel, excellent location. Staff consistently friendly and helpful. Bed comfy. Love the happy hour and free breakfast. Only suggestion would be more choice on room service, with some more healthy options. Will be back in April. Thank you to the wonderful staff."
36,We stayed at the Kinzie for two days for a quick trip. The staff was friendly and very accommodating. Thank you to staff Mona and Derrick for going the extra mile to make our stay great! We will definitely be back.
37,"This hotel was awesome. It’s located in River north close to various bars,clubs,lounge and restaurants. The hotel has great staff. The room was luxurious with all the amenities. I will definitely stay here again."
38,I had a FANTASTIC experience with the front desk attendant Mona and Victor were completely FANTASTIC. The bartender Matt was amazing as well. Great room & Amazing amenities and Beautiful property. Amazing!! I booked the room close to a testing center I had exams at the following day and had a great night rest and was able to walk 5-7 mins to my exams. Thank you to the AWESOME Kinzie Staff for making my night stay WONDERFUL!
39,I went to Chicago for a short girls' trip with my two daughters and cousin.  I can't say enough about how we enjoyed our stay at Hotel Kinzie! We loved how it was so personal. The rooms were wonderful and we felt like the staff was really watching out for us. We felt very safe!  The location couldn't have been better. Located right in the middle of everything on the river downtown. So many things in walking distance. We walked to dinner and a super cool tiki bar the first night. Hit a ping-pong club the second. We would definitely stay there again and recommend to anyone!
40,"Cozy and stylish room! Appreciated the extra things offered in the room, especially for getting ready. LOVED the complimentary happy hour! The only thing I wasn’t a fan of was our view. 😕 Great location to restaurants, bars, music venues, and shopping!"
41,"I've traveled all over the world and stayed at some of the best hotels. I didn't know what to expect when I booked a room at Kinzie Hotel. Not only was my greeting upon arrival and check-in pleasant and easy, the room was modern, clean and pretty cool! Bathroom and fixtures were well done. Strong shower. Ordered room service and had one of the best salads of my life! I admired the pens in the room and upon checkout asked if I could have a couple...the fellow ran out and secured me a few to take with me. Great location and a great stay. I was pleasantly surprised and will recommend Kinzie Hotel to friends and family visiting me in Chicago."
42,"I very much enjoyed my stay at the Kinzie Hotel. From the ""informal"" lobby full of friendly staff to the generous rooms with lots of natural light, this hotel offers a great atmosphere. The continental breakfast and cocktail hour were much better than what is offered in more standard ""chain"" hotels. The location was convenient to meetings I had in the Loop, even walkable in some cases. I highly recommend this option and will definitely return!"
43,"Spent two nights here over the weekend. Excellent location and easy to find. Lovely, friendly staff and a quirky design. Rooms are clean and fresh and the bed was super comfy. Loved the complimentary breakfast and happy hour. Looking forward to returning in April, June, July and September!"
44,"I was greeted by friendly staff, stayed in a very modern and comfortable room, and enjoyed a tasty breakfast the next morning. Other perks were easy check out, text communication with the concierge, and a happy hour for all guests.  Would recommend this hotel to others and will absolutely stay here again."
45,"So it's been a while since my visit and am just now getting around to reviewing, as I just came across my room photos on my phone. Anyhooo, it's a really lovely hotel. Nicely decorated. Very comfortable room. Nice lounge/cocktail hour upstairs. Had an off the street room so no noise issues, but not much in the way of a view. It really was just a great hotel. "
46,"Had the best corner room on the 4th floor! So many windows and the view was really nice! The best past was Spencer at concierge, he was very friendly and personable  and gave us such positive experience I love how they offer a text message service for places to eat and places to go within walking distance which is helpful for people from out of town. Also Derrick at Valet was very friendly and helpful. Thank you for such a great Customer service and we have already told our friends to stay here next time! We hope to be back soon!  -Kristal & Tom H."
47,Room was perfect and very relaxing.  We were sad to miss the managers reception this time but have gone to it several times before.  Greeted warmly by the bell captain and then by the front desk.  The hotel was spotless
48,"We LOVED staying at the Kinzie. The Staff was Exceptional and made the experience so wonderful. We brought our two large dogs. They loved all the attention, the dog beds and houses, the treats, and the toys. They are still wearing their Kinzie bananas a week later. We used the valet for our car and had to trouble the staff with putting away and bringing out our car multiple times so we could drive it to our locations. The Staff always had a smile and never complained. I have been recommending the Kinzie to everyone I meet, telling them to stay there regardless of if they have dogs or not. We will 100% be back to stay next time we visit Chicago. THANK YOU."
49,"Only good things to say about our stay! Great location near great bars, jazz clubs, short walk to Michigan Ave. Loved the nightly happy hour. Room and amenities were awesome and staff were always friendly, greeting us everytime we returned. And on top of all that...great price!! "
50,"Will definitely be back to stay in the Kinzie hotel, from the spacious bedroom to the happy hour we enjoyed all the Kinzie had to offer. It's in an ideal location, with pubs, restaurants and shopping all in walking distance, as is access to all forms of public transport. The staff were friendly and helpful, the text service with reception was useful and included recommendations on things to see and do."
51,"Visited this hotel on Boxing Day for 5 days with my sister to see Chicago and shop. The hotel was very central to everything and we had a great time. The room was lovely, very spacious and clean. Great lounge time each night for 2 hours with wine, beer and snacks. Also continental breakfast good too. The hotel staff were the most friendly amazing people and we will definitely be returning here in the future. This was my first visit but my sisters third, we loved Chicago.  Special thank you to Lexi who was an amazing help when our flight got cancelled, she was so patient and helped us deal with airline, rebook into hotel and also sorted our transfer back to airport. We are so grateful and hope to thank you in person some day.  All the staff were great, brilliant hotel, would"
52,"My 15-year-old daughter and I headed to Chicago the day after Christmas to enjoy the lights on Michigan Avenue and do some shopping. The Kinzie Hotel was perfect for us! So close to Michigan Avenue for walking, and the staff could not be any nicer! This hotel was clean and the staff were so helpful when I had a problem with my reservation. My reservation problem was not the hotel’s fault, it was Booking.com’s error, but the Kinzie staff corrected it for me. I will stay here again!!"
53,"The bride picked this as her base for the wedding so all the bridesmaids and family stayed here and we were treated like royalty.   From check in to check out we were pampered, taken care of and generally loved to death.   The happy hour and breakfast buffets were fun and appreciated. And the rooms were soundproof and large.   We will definitely stay here again - even without the bride!!  Well done, Kinzie! And special thanks to Victor who helped me  get through a couple of rough patches!!"
54,"Booked this hotel for fun romantic getaway and birthday celebration.  Unfortunately our child fell ill at home and we were unable to complete our stay.  The manager would not work with us whatsoever.  Have stayed here several times before but will find somewhere else to patronize in the future.  Love staying in River North, but fortunately there are numerous other options."
55,"So it's been a while since my visit and am just now getting around to reviewing, as I just came across my room photos on my phone. Anyhooo, it's a really lovely hotel. Nicely decorated. Very comfortable room. Nice lounge/cocktail hour upstairs. Had an off the street room so no noise issues, but not much in the way of a view. It really was just a great hotel. "
56,"Had the best corner room on the 4th floor! So many windows and the view was really nice! The best past was Spencer at concierge, he was very friendly and personable  and gave us such positive experience I love how they offer a text message service for places to eat and places to go within walking distance which is helpful for people from out of town. Also Derrick at Valet was very friendly and helpful. Thank you for such a great Customer service and we have already told our friends to stay here next time! We hope to be back soon!  -Kristal & Tom H."
57,Room was perfect and very relaxing.  We were sad to miss the managers reception this time but have gone to it several times before.  Greeted warmly by the bell captain and then by the front desk.  The hotel was spotless
58,"We LOVED staying at the Kinzie. The Staff was Exceptional and made the experience so wonderful. We brought our two large dogs. They loved all the attention, the dog beds and houses, the treats, and the toys. They are still wearing their Kinzie bananas a week later. We used the valet for our car and had to trouble the staff with putting away and bringing out our car multiple times so we could drive it to our locations. The Staff always had a smile and never complained. I have been recommending the Kinzie to everyone I meet, telling them to stay there regardless of if they have dogs or not. We will 100% be back to stay next time we visit Chicago. THANK YOU."
